{
  "$schema": "https://json-schema.org/draft/2020-12/schema",
  "$id": "issue.schema.json",
  "type": "object",
  "additionalProperties": false,
  "required": ["issue_id", "gate", "severity", "message", "status"],
  "properties": {
    "issue_id": { "type": "string" },
    "gate": { "type": "string" },
    "severity": { "enum": ["info", "warn", "error", "blocker"] },
    "message": { "type": "string" },
    "error_code": {
      "type": "string",
      "pattern": "^[A-Z][A-Z0-9_-]*$",
      "description": "Structured error code per specs/01_system_contract.md error taxonomy. Allows uppercase letters, digits, underscores, and hyphens (e.g., GATE_TIMEOUT, G17-FQ-4, G16-001)."
    },
    "files": { "type": "array", "items": { "type": "string" } },
    "location": {
      "type": "object",
      "additionalProperties": false,
      "properties": {
        "path": { "type": "string" },
        "line": { "type": "integer" }
      }
    },
    "suggested_fix": { "type": "string" },
    "status": { "enum": ["OPEN", "IN_PROGRESS", "RESOLVED"] }
  },
  "allOf": [
    {
      "if": {
        "properties": {
          "severity": { "enum": ["error", "blocker"] }
        }
      },
      "then": {
        "required": ["error_code"]
      }
    }
  ]
}
